{
  "$schema": "../../../backend/sdlcctl/sdlcctl/schemas/spec-evidence-schema.json",
  "spec_id": "ADR-044",
  "spec_title": "GitHub Integration Strategy",
  "spec_type": "architecture",
  "implementation_date": "2026-01-30",
  "sprint": "Sprint 129",
  "interfaces": {
    "backend": {
      "api_routes": [
        "backend/app/api/routes/github.py"
      ],
      "services": [
        "backend/app/services/github_service.py",
        "backend/app/services/github_app_service.py",
        "backend/app/services/github_webhook_service.py",
        "backend/app/services/github_errors.py",
        "backend/app/services/github_check_run_service.py",
        "backend/app/services/github_checks_service.py"
      ],
      "models": [
        "backend/app/models/github_integration.py"
      ],
      "schemas": [
        "backend/app/schemas/github.py"
      ],
      "tests": [
        "backend/tests/integration/test_github_app_integration.py",
        "backend/tests/services/test_github_webhook_service.py",
        "backend/tests/services/test_github_service.py",
        "backend/tests/unit/test_github_app_service.py",
        "backend/tests/unit/test_github_check_run_service.py",
        "backend/tests/unit/services/test_github_errors.py"
      ],
      "coverage": 92.0,
      "status": "complete"
    },
    "frontend": {
      "components": [
        "frontend/src/components/github/GitHubConnectButton.tsx",
        "frontend/src/components/github/GitHubRepoList.tsx",
        "frontend/src/components/github/GitHubSettingsPanel.tsx"
      ],
      "pages": [
        "frontend/src/app/settings/github/page.tsx"
      ],
      "hooks": [
        "frontend/src/hooks/useGitHub.ts"
      ],
      "tests": [
        "frontend/e2e/github-integration.spec.ts",
        "frontend/src/components/github/GitHubConnectButton.test.tsx"
      ],
      "status": "complete"
    },
    "extension": {
      "commands": [
        "vscode-extension/src/commands/connectGithubCommand.ts"
      ],
      "services": [],
      "views": [],
      "tests": [
        "vscode-extension/src/test/suite/github.test.ts"
      ],
      "status": "partial"
    },
    "cli": {
      "commands": [],
      "services": [
        "backend/sdlcctl/sdlcctl/services/github_service.py"
      ],
      "tests": [
        "backend/sdlcctl/tests/test_github_cli.py",
        "backend/sdlcctl/tests/e2e/test_github_init_e2e.py"
      ],
      "status": "complete"
    }
  },
  "validation": {
    "last_checked": "2026-02-01T10:14:54.815336Z",
    "checker_version": "1.0.0",
    "status": "partial",
    "missing_files": [
      "frontend/src/components/github/GitHubConnectButton.tsx",
      "frontend/src/components/github/GitHubRepoList.tsx",
      "frontend/src/components/github/GitHubSettingsPanel.tsx",
      "frontend/src/app/settings/github/page.tsx",
      "frontend/e2e/github-integration.spec.ts",
      "frontend/src/components/github/GitHubConnectButton.test.tsx"
    ],
    "warnings": []
  },
  "notes": "Sprint 129 - GitHub Integration Strategy. Backend 100% complete (6 services, 6 tests, 92% coverage). Frontend 0% complete (5 components missing). Extension partial (command source code missing, only compiled output exists). CLI complete with GitHub service integration."
}
