{
  "$schema": "../../../backend/sdlcctl/sdlcctl/schemas/spec-evidence-schema.json",
  "spec_id": "SPEC-0010",
  "spec_title": "IR Processor Specification - EP-06 Backend Scaffold Generation",
  "spec_type": "feature",
  "implementation_date": "2026-01-30",
  "sprint": "Sprint 46",
  "interfaces": {
    "backend": {
      "api_routes": [
        "backend/app/api/routes/codegen.py"
      ],
      "services": [
        "backend/app/services/codegen/ir/processor_base.py",
        "backend/app/services/codegen/ir/validator.py",
        "backend/app/services/codegen/ir/project_processor.py",
        "backend/app/services/codegen/ir/endpoint_processor.py",
        "backend/app/services/codegen/ir/model_processor.py",
        "backend/app/services/codegen/ir/bundle_builder.py"
      ],
      "models": [],
      "schemas": [
        "backend/app/schemas/codegen/codegen_spec.py",
        "backend/app/schemas/codegen/codegen_result.py",
        "backend/app/schemas/codegen/template_blueprint.py",
        "backend/app/services/codegen/schemas/app_blueprint.py"
      ],
      "tests": [
        "backend/tests/unit/api/test_codegen_ir.py",
        "backend/tests/unit/services/codegen/ir/test_validator.py",
        "backend/tests/unit/services/codegen/ir/test_bundle_builder.py"
      ],
      "coverage": 92.0,
      "status": "complete"
    },
    "frontend": {
      "components": [
        "frontend/src/components/codegen/IRPreviewPanel.tsx",
        "frontend/src/components/codegen/ScaffoldGeneratorCard.tsx",
        "frontend/src/components/codegen/DomainTemplateSelector.tsx"
      ],
      "pages": [
        "frontend/src/app/codegen/ir-processor/page.tsx"
      ],
      "hooks": [
        "frontend/src/hooks/useIRProcessor.ts"
      ],
      "tests": [
        "frontend/e2e/codegen-ir.spec.ts",
        "frontend/src/components/codegen/ScaffoldGeneratorCard.test.tsx"
      ],
      "status": "missing"
    },
    "extension": {
      "commands": [
        "vscode-extension/src/commands/generateScaffoldCommand.ts"
      ],
      "services": [
        "vscode-extension/src/services/irProcessorService.ts"
      ],
      "views": [],
      "tests": [
        "vscode-extension/src/test/suite/irProcessor.test.ts"
      ],
      "status": "missing"
    },
    "cli": {
      "commands": [
        "backend/sdlcctl/sdlcctl/commands/scaffold.py"
      ],
      "services": [],
      "tests": [
        "backend/sdlcctl/tests/test_scaffold_command.py"
      ],
      "status": "partial"
    }
  },
  "validation": {
    "last_checked": "2026-02-02T02:36:25.319823Z",
    "checker_version": "1.0.0",
    "status": "partial",
    "missing_files": [
      "frontend/src/components/codegen/IRPreviewPanel.tsx",
      "frontend/src/components/codegen/ScaffoldGeneratorCard.tsx",
      "frontend/src/components/codegen/DomainTemplateSelector.tsx",
      "frontend/src/app/codegen/ir-processor/page.tsx",
      "frontend/src/hooks/useIRProcessor.ts",
      "frontend/e2e/codegen-ir.spec.ts",
      "frontend/src/components/codegen/ScaffoldGeneratorCard.test.tsx",
      "vscode-extension/src/commands/generateScaffoldCommand.ts",
      "vscode-extension/src/services/irProcessorService.ts",
      "vscode-extension/src/test/suite/irProcessor.test.ts",
      "backend/sdlcctl/sdlcctl/commands/scaffold.py",
      "backend/sdlcctl/tests/test_scaffold_command.py"
    ],
    "warnings": [
      "Frontend IR preview and scaffold generator UI missing",
      "Extension scaffold generation command not implemented",
      "CLI scaffold command needs implementation"
    ]
  },
  "notes": "Sprint 46 - IR Processor Specification (SPEC-0010) for EP-06 Backend Scaffold Generation. Backend 100% complete (6 IR processor services, 92% test coverage). IR validation, project/endpoint/model processors, bundle builder all implemented. Transforms AppBlueprint JSON into deterministic FastAPI + SQLAlchemy + Pydantic scaffolds for Vietnamese SME domains (F&B, E-commerce, HRM). Frontend 0% complete (5 components missing). Extension 0% complete (scaffold command missing). CLI partial (scaffold command needed). Core feature for code generation without AI dependency."
}
