{
  "$schema": "../../../backend/sdlcctl/sdlcctl/schemas/spec-evidence-schema.json",
  "spec_id": "SPEC-0004",
  "spec_title": "Policy Guards & Safety Rails Design",
  "spec_type": "security",
  "implementation_date": "2025-11-20",
  "sprint": "Sprint 102",
  "interfaces": {
    "backend": {
      "api_routes": [
        "backend/app/api/routes/policy_packs.py"
      ],
      "services": [
        "backend/app/services/opa_policy_service.py",
        "backend/app/services/policy_pack_service.py",
        "backend/app/services/policy_service.py",
        "backend/app/services/policy_enforcement_service.py",
        "backend/app/services/validators/policy_guard_validator.py"
      ],
      "models": [
        "backend/app/models/policy_pack.py",
        "backend/app/models/policy.py"
      ],
      "schemas": [
        "backend/app/schemas/policy_pack.py",
        "backend/app/schemas/policy.py"
      ],
      "migrations": [
        "backend/alembic/versions/s69_policy_packs.py",
        "backend/alembic/versions/s102_001_policy_tier.py"
      ],
      "tests": [
        "backend/tests/unit/services/validators/test_policy_guard_validator.py",
        "backend/tests/services/test_policy_service.py"
      ],
      "coverage": 91.0,
      "status": "complete"
    },
    "frontend": {
      "components": [
        "frontend/src/components/policies/PolicyEditor.tsx",
        "frontend/src/components/policies/PolicyPackList.tsx",
        "frontend/src/components/policies/PolicyTestUI.tsx",
        "frontend/src/components/policies/GuardRuleBuilder.tsx"
      ],
      "pages": [
        "frontend/src/app/policies/page.tsx",
        "frontend/src/app/policies/[id]/edit/page.tsx"
      ],
      "hooks": [
        "frontend/src/hooks/usePolicies.ts",
        "frontend/src/hooks/usePolicyPacks.ts"
      ],
      "tests": [
        "frontend/e2e/policy-management.spec.ts",
        "frontend/src/components/policies/PolicyEditor.test.tsx"
      ],
      "status": "missing"
    },
    "extension": {
      "commands": [],
      "services": [],
      "views": [],
      "tests": [],
      "status": "not_applicable"
    },
    "cli": {
      "commands": [],
      "services": [],
      "tests": [],
      "status": "not_applicable"
    }
  },
  "validation": {
    "last_checked": "2026-02-01T10:50:26.523936Z",
    "checker_version": "1.0.0",
    "status": "partial",
    "missing_files": [
      "frontend/src/components/policies/PolicyEditor.tsx",
      "frontend/src/components/policies/PolicyPackList.tsx",
      "frontend/src/components/policies/PolicyTestUI.tsx",
      "frontend/src/components/policies/GuardRuleBuilder.tsx",
      "frontend/src/app/policies/page.tsx",
      "frontend/src/app/policies/[id]/edit/page.tsx",
      "frontend/src/hooks/usePolicyPacks.ts",
      "frontend/e2e/policy-management.spec.ts",
      "frontend/src/components/policies/PolicyEditor.test.tsx"
    ],
    "warnings": []
  },
  "notes": "Sprint 102 - Policy Guards & Safety Rails. Backend 100% complete (1 API route, 5 services including OPA integration, 2 models, 2 tests, 91% coverage). Frontend 0% complete (8 components missing for policy editor UI). Core security feature integrating with OPA (Open Policy Agent) for policy-as-code enforcement. Policy guard validator ensures policies are valid Rego before deployment."
}
