{
  "$schema": "../../../backend/sdlcctl/sdlcctl/schemas/spec-evidence-schema.json",
  "spec_id": "SPEC-0001",
  "spec_title": "Anti-Vibecoding Quality Assurance System",
  "spec_type": "feature",
  "implementation_date": "2026-01-29",
  "sprint": "Sprint 106",
  "interfaces": {
    "backend": {
      "api_routes": [
        "backend/app/api/routes/vibecoding_index.py",
        "backend/app/api/routes/governance_vibecoding.py"
      ],
      "services": [
        "backend/app/services/vibecoding_service.py"
      ],
      "models": [
        "backend/app/models/governance_vibecoding.py"
      ],
      "schemas": [
        "backend/app/schemas/vibecoding.py"
      ],
      "tests": [
        "backend/tests/services/test_vibecoding_service.py",
        "backend/tests/integration/test_vibecoding_flow.py"
      ],
      "coverage": 95.0,
      "status": "complete"
    },
    "frontend": {
      "components": [
        "frontend/src/components/governance/vibecoding/VibecodingDashboard.tsx",
        "frontend/src/components/governance/vibecoding/SignalBreakdown.tsx",
        "frontend/src/components/governance/vibecoding/RoutingDecisionCard.tsx",
        "frontend/src/components/governance/kill-switch/KillSwitchDashboard.tsx"
      ],
      "pages": [
        "frontend/src/app/app/governance/page.tsx"
      ],
      "hooks": [
        "frontend/src/hooks/useVibecoding.ts"
      ],
      "tests": [
        "frontend/e2e/vibecoding.spec.ts",
        "frontend/src/components/governance/vibecoding/VibecodingDashboard.test.tsx"
      ],
      "status": "complete"
    },
    "extension": {
      "commands": [],
      "services": [],
      "views": [],
      "tests": [],
      "status": "not_applicable"
    },
    "cli": {
      "commands": [
        "backend/sdlcctl/sdlcctl/commands/vibecoding.py"
      ],
      "services": [],
      "tests": [
        "backend/sdlcctl/tests/test_vibecoding_command.py"
      ],
      "status": "partial"
    }
  },
  "validation": {
    "last_checked": "2026-02-01T10:50:26.503722Z",
    "checker_version": "1.0.0",
    "status": "partial",
    "missing_files": [
      "backend/app/schemas/vibecoding.py",
      "frontend/src/hooks/useVibecoding.ts",
      "frontend/e2e/vibecoding.spec.ts",
      "frontend/src/components/governance/vibecoding/VibecodingDashboard.test.tsx",
      "backend/sdlcctl/sdlcctl/commands/vibecoding.py",
      "backend/sdlcctl/tests/test_vibecoding_command.py"
    ],
    "warnings": [
      "Vibecoding schemas need to be extracted from services",
      "Frontend hooks and tests missing (components exist)",
      "CLI vibecoding command needs implementation"
    ]
  },
  "notes": "Sprint 106 - Anti-Vibecoding Quality Assurance System (SPEC-0001). Backend 100% complete (2 API routes, vibecoding service, governance model, 95% coverage). Frontend 100% complete (4 components exist: VibecodingDashboard, SignalBreakdown, RoutingDecisionCard, KillSwitchDashboard - but hooks and tests missing). CLI partial (vibecoding command needed). Core feature calculates Vibecoding Index (0-100 risk score) from 5 weighted signals (Intent, Ownership, Context, Attestation, Rejection). Progressive routing: GREEN (0-30) auto-approve, YELLOW (31-60) tech lead, ORANGE (61-80) CEO optional, RED (81-100) CEO mandatory. Kill switch activates on rejection >80%, latency >500ms, or 5+ CVEs. Tier-aware enforcement: PROFESSIONAL (warning), ENTERPRISE (full enforcement)."
}
